FactSet Entity ID,Institution_name,Discrepancy_Column,
0CLN65-E,FOURPOINTS Investment Managers SAS, ,
0CWSLR-E,"FP Financial Services, Inc.", ,
003FR2-E,Family Capital Trust Co. (Investment Management), ,
000LH9-E,Federated MDTA LLC, ,
003PBV-E,"Fiduciary International, Inc.",Incorrect: style-(Ownership:None Profile: ) ,
0DV2BP-E,Fiduciary Trust Company of Canada, ,
0H1LK0-E,Fieldpoint Private Securities LLC (Investment Management), ,
0B1W7T-E,Fiera Capital Corp. (Investment Management), ,
0CZ1TQ-E,"Financial Advisors Network, Inc.", ,
07WTHL-E,Financiere Lamartine SA,,
081NBC-E,Finles NV,,
0C6CBB-E,Finpartner Financial Services SA, ,
002HFX-E,Fir Tree Capital Management LP, ,
0DZJBJ-E,First Citizens Bank & Trust Co. (Raleigh NC) (Wealth Mgmt), ,
004189-E,First Eagle Investment Management LLC, ,
002L3J-E,First Financial Bank N.A. - Trust Division, ,
002H8C-E,"First Financial Bank, NA (Terre Haute, Indiana)", ,
005N30-E,First Financial Equity Corp.,,
070X2Y-E,"First Houston Capital, Inc.",,
000KJ7-E,Fisher Asset Management LLC, ,
05M7YW-E,Flexible Plan Investments Ltd., ,
0C3HQ2-E,"Focused Wealth Management, Inc.", ,
0FCZCD-E,Folger Hill Asset Management LP, ,
060LWY-E,Force Capital Management LLC, ,
007VNJ-E,Forward Management LLC, ,
05PRB3-E,"Founders Capital Management, Inc.", ,
0C9WCM-E,Fox Run Management LLC, ,
05FWF7-E,Franklin Templeton Investment Management Ltd., ,
0B6TMW-E,Franklin Templeton Investment Management Ltd. (Germany), ,
06D5R5-E,Franklin Templeton Investments (Asia) Ltd., ,
00356P-E,Franklin Templeton Investments Corp., ,
0032WD-E,Freestone Capital Management LLC, ,
07DJB0-E,"Fuh Hwa Securities Investment Trust Co., Ltd.", ,
002H2R-E,"Fuller & Thaler Asset Management, Inc.", ,
0KRXXX-E,"Fulton Bank, Na (Investment Management)", ,
00309R-E,Fulton Breakefield Broenniman LLC, ,
000KYJ-E,"GE Asset Management, Inc.",,
05Q5JJ-E,GFO Advisory Services LLC,,
0CSDC8-E,GLC Asset Management Group Ltd., ,
005VV0-E,GLG Partners LP, ,
09ZMDD-E,"GLG, Inc.",,
0BJ0FZ-E,GO ETF Solutions LLP, ,
0080QY-E,GSA Capital Partners LLP, ,
06ZPG1-E,GVO Asset Management AG, ,
0035DT-E,GW & Wade LLC, ,
00BJCT-E,Galaxy Capital Management,,
002HSX-E,Gamble Jones Investment Counsel, ,
0C3HMF-E,"Garde Capital, Inc.", ,
00176H-E,Gardner Lewis Asset Management LP, ,
0C9N8P-E,"Gary Goldberg Planning Services, Inc.",Incorrect: style-(Ownership:None Profile: ) ,
00820D-E,Geller Advisors LLC, ,
001HP4-E,General Motors Investment Management Corp., ,
0JYC91-E,Generali Investments Partners SpA SGR, ,
061KPV-E,Generation Vie SA,,
06P76W-E,Genesee Valley Trust Co., ,
00DCT5-E,Genesis Capital LLC (Washington),,
05QVZQ-E,Geneva Advisors LLC,,
0C2K4M-E,Geneva Partners LLC, ,
05HRSY-E,Gesalcala SA SGIIC, ,
00FYZ2-E,"Gideon Capital Advisors, Inc.", ,
08CKLS-E,Gilman Hill Asset Management LLC, ,
06F9HC-E,Glaxis Capital Management LLC, ,
00GLK4-E,"Godshalk Welsh Capital Management, Inc.", ,
00346G-E,Golden Capital Management LLC,,
07VV1D-E,Goodman Financial Corp., ,
00D0GG-E,Grabill Bank Wealth Management,Incorrect: style-(Ownership:None Profile: ) ,
000L3V-E,"Grantham, Mayo, Van Otterloo & Co. LLC", ,
0C6KP1-E,Graticule Asia Macro Advisors LLC, ,
0788J8-E,Green Arrow Capital Management LLC,,
003KYP-E,Green Square Capital Advisors LLC, ,
001XC9-E,"Greenhaven Associates, Inc.", ,
0DMR4C-E,Greenhouse Funds LLLP, ,
00BCGS-E,Greenwich Wealth Management LLC, ,
0CTYYV-E,Ground Swell Capital LLC,Incorrect: style-(Ownership:None Profile: ) ,
07SJYN-E,Group One Trading LP, ,
05FW5J-E,Groupama Asset Management SA, ,
0GJH65-E,Gryphon Financial Partners LLC, ,
002HKS-E,Guardian Investor Services LLC,,
06SVND-E,Guardians of New Zealand Superannuation,Incorrect: aum-(Ownership:26995 Profile: 26856) eaum-(Ownership:None Profile: 14939) ,
0CCBJF-E,Guggenheim Global Trading LLC,,
0DDS1G-E,Gupta Wealth Management LLC,,
00CFYZ-E,HAP Trading LLC, ,
0012ZV-E,HBK Investments LP, ,
0090CC-E,HHG & Co LLC,,
06XZGC-E,HINKEL & Cie. Vermogensverwaltung AG, ,
00FDDB-E,HRT Financial LLC, ,
0DG0CY-E,HSBC Global Asset Management (France) SA (Private Banking), ,
05SFRR-E,HSBC Global Asset Management (Taiwan) Ltd., ,
00CFMZ-E,Halbert Hargrove Global Advisors LLC, ,
002J17-E,Halcyon Offshore Asset Management,,
05VGC6-E,Handelsbanken Fonder AB, ,
0032S1-E,"Hanseatic Management Services, Inc.", ,
002SRC-E,Harbor Advisory Corp., ,
09Q0WM-E,Hatteras Capital Investment Management LLC,Incorrect: style-(Ownership:None Profile: ) ,
00C6P0-E,Hatteras Funds LP, ,
0BTNQD-E,Hauck & Aufhauser (Schweiz) AG, ,
0GPRG7-E,Hayden Royal LLC, ,
0C95PB-E,"Hefty Wealth Partners, Inc.", ,
05FVRY-E,"Hennessy Advisors, Inc. (Investment Management)", ,
0G8X05-E,Heritage Trust Co., ,
05SV25-E,Herndon Capital Management LLC,,
003C59-E,High Point Bank & Trust Co.,,
002JJY-E,Highbridge Capital Management LLC, ,
002CS5-E,Highfields Capital Management LP, ,
00DQTN-E,Highland Capital Management Fund Advisors LP, ,
002GWM-E,Highland Capital Management LLC, ,
00D6V2-E,Highlander Capital Management LLC, ,
06WM8F-E,Highmount Capital LLC,,
05JP7W-E,"Highstreet Asset Management, Inc.", ,
064NPL-E,"Hirtle, Callaghan & Co. LLC", ,
0GG87J-E,"Holocene Advisors, LP", ,
05J826-E,Honeywell Capital Management LLC, ,
085YB9-E,"Honkamp Krueger Financial Services, Inc.", ,
005HMY-E,Hoplite Capital Management LP, ,
0090BN-E,"Horrell Capital Management, Inc.", ,
000LV0-E,"Howard Hughes Medical Institute, Inc. (Investment Management)", ,
0618F5-E,Hudson Bay Capital Management LP, ,
08333P-E,Hutchin Hill Capital LP,,
002FGZ-E,I. G. Investment Management Ltd., ,
0DFGS2-E,IBERIABANK Corp. (Wealth Advisors), ,
0DLBJQ-E,IBEX Wealth Advisors LLC, ,
0DV75X-E,IHT Wealth Management LLC, ,
008RY4-E,IKOS CIF Ltd.,,
05FK9S-E,"IMS Capital Management, Inc.", ,
0GNK0M-E,"INTL FCStone, Inc. (Investment Management)", ,
06QS2J-E,IPM Informed Portfolio Management AB, ,
06C26D-E,Ilirika DZU doo,,
05NDVW-E,Illinois State Board of Investment, ,
070484-E,Imalivest (Pty) Ltd., ,
007J84-E,"Independent Portfolio Consultants, Inc.",,
09KMB3-E,Index Management Solutions LLC,,
00BL9L-E,Indices-Pac Research Corp.,,
05HL2P-E,"Industrial Alliance Investment Management, Inc.", ,
0CYLRN-E,Integral Derivatives LLC, ,
003NZ2-E,"Integrated Wealth Management, Inc.",,
007ZSX-E,Integre Asset Management LLC, ,
00GM83-E,Intersect Capital LLC, ,
05FW6C-E,Invesco Asset Management Ltd., ,
05FW6B-E,Invesco Asset Management SA, ,
05K2L0-E,Invesco Australia Ltd., ,
05SL4M-E,Investitori SGR SpA, ,
00DY2K-E,Invictus RG Pte Ltd., ,
00925W-E,Ionic Capital Management LLC, ,
001MCT-E,Iridian Asset Management LLC, ,
05XF3L-E,Irish Life Investment Managers Ltd., ,
00DQWY-E,"Itau USA Asset Management, Inc.", ,
0035G5-E,Ivory Investment Management LLC, ,
004HYR-E,J. Goldman & Co. LP, ,
05JW6J-E,J. M. Finn & Co. Ltd., ,
0CSQXZ-E,JAG Capital Management LLC, ,
00CP18-E,"JOYN Advisors, Inc.", ,
060LRN-E,"JPMorgan Alternative Asset Management, Inc.", ,
00B25F-E,"JPMorgan Private Investments, Inc.", ,
0BHJKC-E,JRS Finanzmandate GmbH, ,
003HCX-E,Jackson National Asset Management LLC, ,
0C2Z34-E,Jackson Wealth Management LLC, ,
0GDDL2-E,Jafra Capital Management LP, ,
002GD0-E,"James Investment Research, Inc.", ,
002HG9-E,"Jamison, Eaton & Wood, Inc.",Incorrect: style-(Ownership:None Profile: ) ,
000N8F-E,Janus Capital Management LLC, ,
001FKZ-E,Jennison Associates LLC, ,
006WN9-E,Jet Capital Investors LP, ,
003KYY-E,Joel Isaacson & Co. LLC, ,
0C271W-E,Jolley Asset Management LLC, ,
0074DB-E,Jump Trading LLC, ,
0D6568-E,Juristernes og Okonomernes Pensionskasse (Invt Mgmt),,
006LHB-E,K2/D&S Management Co. LLC, ,
05K7X7-E,KBC Bank NV,,
0B4RZ5-E,KBI Global Investors Ltd., ,
07FRP2-E,KKR Credit Advisors (US) LLC, ,
00C18P-E,KKR Investment Management LLC, ,
001KC7-E,"KR Capital Advisors, Inc.",,
002J75-E,Kanaly Trust LTA,,
0C7L4Y-E,Karp Capital Management Corp., ,
001TNS-E,"Karpus Management, Inc.", ,
05L23X-E,Kathrein Privatbank AG, ,
00FC8B-E,"Kemnay Advisory Services, Inc.", ,
05J8FY-E,Kemper Corp. (Investment Portfolio), ,
05HF4Q-E,"Keppler Asset Management, Inc.", ,
07JNPX-E,"Kerns Capital Management, Inc.", ,
07FQXX-E,Kivun Trust Funds Management Co. Ltd., ,
0C9HLJ-E,"Koshinski Asset Management, Inc.", ,
06V5TT-E,Kraus Partner Investment Solutions AG, ,
0C2BGL-E,Krilogy Financial LLC, ,
0CZV8H-E,LCM Investment Management LLC, ,
0C8LNG-E,LGL Partners LLC, ,
0CCKJS-E,LVW Advisors LLC, ,
0F9D6M-E,La Mondiale SAM (Investment Portfolio), ,
0GNF3C-E,Lakefield Partners AG, ,
06QP03-E,Lan & Spar Bank A/S (Investment Management), ,
05ZNRW-E,Landaas & Co., ,
05GVDG-E,Lansforsakringar Fondforvaltning AB, ,
06FW7F-E,Laurion Capital Management LP, ,
002HGC-E,"Lawrence W. Kelly & Associates, Inc.", ,
05LYGJ-E,Lebenthal Asset Management LLC,,
0FCC6S-E,Lebenthal Wealth Advisors LLC,,
0C8NX6-E,"Lehman Financial Resources, Inc.", ,
05HW0X-E,Lemanik Asset Management SA, ,
0CXY75-E,"Lenox Wealth Advisors, Inc.", ,
0DYJ10-E,Liberty Mutual Insurance Co. (Investment Portfolio), ,
0010SD-E,Libra Advisors LLC, ,
0C8PDW-E,Limestone Value Partners LLC,,
00C7HH-E,Lincoln Investment Advisors Corp., ,
07LDR5-E,LionEye Capital Management LLC,,
008QZL-E,Livingston Group Asset Management Co., ,
00306H-E,"Logan Capital Management, Inc.", ,
0CMT5V-E,Lomas Capital Management LLC, ,
074C8T-E,Lombard Odier Asset Management (Switzerland) SA, ,
00CLJ7-E,Lombard Odier Asset Management (USA) Corp., ,
006WQQ-E,Lonestar Capital Management LLC, ,
05M6VN-E,"Long Wharf Investors, Inc.",Incorrect: style-(Ownership:None Profile: ) ,
05VJKZ-E,Longbow Capital Partners LP,,
0DD9QT-E,Lorem Ipsum Management LLC,,
003HJH-E,M&I Investment Management Corp.,Incorrect: style-(Ownership:None Profile: ) ,
095BC9-E,MFI Asset Management GmbH, ,
002YWR-E,MFS Investment Management Canada Ltd., ,
0DH2NF-E,MML Investment Advisers LLC, ,
0C37Y3-E,MPS-LORIA Financial Planners LLC, ,
005NLJ-E,"MSI Financial Services, Inc.",,
007Q5V-E,MUFG Securities EMEA Plc, ,
0C3LM4-E,MacroView Investment Management LLC, ,
006KWB-E,Madison Asset Management LLC, ,
00D132-E,Madison Investment Advisors LLC, ,
0BWPJF-E,Madrona Funds LLC, ,
0080MR-E,Magnetar Financial LLC, ,
0C5TK4-E,MainStreet Investment Advisors LLC, ,
0C26W3-E,Mainstay Capital Management LLC, ,
0GQ2RL-E,Mana Advisors LLC, ,
001150-E,Manning & Napier Advisors LLC, ,
002GB5-E,Manulife Asset Management (US) LLC, ,
05HRJK-E,Mapfre Asset Management SGIIC SA, ,
05H9PN-E,"Maple Securities USA, Inc.",,
0D7YQX-E,Marianas Fund Management LLC,,
0FK13C-E,Mariner Wealth Advisors NYC LLC,,
002J2D-E,Markel-Gayner Asset Management Corp., ,
00D6QM-E,Marshall Wace Asia Ltd., ,
002HBL-E,Martingale Asset Management LP, ,
002H71-E,"Marvin & Palmer Associates, Inc.", ,
000PHW-E,Massachusetts Financial Services Co., ,
0DYG4N-E,Massachusetts Mutual Life Insurance Co. (Investment Portfolio), ,
08066Y-E,"Massey, Quick & Co. LLC", ,
001JK7-E,"Matrix Asset Advisors, Inc.", ,
003NJ3-E,Mawer Investment Management Ltd., ,
002CVM-E,"Mazama Capital Management, Inc.",,
0FX0R4-E,McAdam LLC, ,
003RL7-E,"McAdams Wright Ragen, Inc.",Incorrect: style-(Ownership:None Profile: ) ,
0DX2TG-E,Measured Wealth Private Client Group LLC, ,
08GD59-E,Mediolanum Asset Management Ltd., ,
05G7PM-E,Meeschaert Asset Management SA, ,
0DCRZ0-E,Meitav Ds Mutual Funds Ltd., ,
008LX4-E,Menta Capital LLC, ,
081D6C-E,Mercer Global Investments Europe Ltd., ,
06X9JS-E,Merchants' Gate Capital LP,,
0D203N-E,Merian Global Investors (UK) Ltd.,Incorrect: aum-(Ownership:44800 Profile: 33700) eaum-(Ownership:13979.116043 Profile: 12054) ,
0C8YKV-E,Meridian Wealth Management LLC, ,
002Y3T-E,Metropolitan West Capital Management LLC,,
05HJQ6-E,Migros Bank AG, ,
0C920J-E,Minich MacGregor Wealth Management LLC, ,
002JCS-E,"Minis & Co., Inc.", ,
002GQB-E,"Mitchell Sinkler & Starr, Inc.", ,
06V997-E,"Mitsubishi UFJ Morgan Stanley Securities Co., Ltd.", ,
06TLC8-E,"Mizuho Asset Management Co., Ltd.",,
006230-E,Mizuho Securities USA LLC, ,
0GVZRZ-E,"Mizuho Trust & Banking Co., Ltd. (Investment Management)", ,
0605XC-E,Mondrian Investment Partners Ltd.,Incorrect: aum-(Ownership:55000 Profile: 47789) eaum-(Ownership:3276.451339 Profile: 12584) ,
0030L1-E,Moneta Group Investment Advisors LLC, ,
002J7H-E,Monroe Bank & Trust, ,
0DZ81B-E,Monroe Hall Asset Management LLC,,
00B59G-E,Montecito Bank & Trust (Invt Mgmt), ,
001VR9-E,Moore Capital Management LP, ,
002H3P-E,Morgan Dempsey Capital Management LLC, ,
063526-E,Morgan Stanley & Co. International Plc, ,
000CKR-E,Morgan Stanley (Switzerland) AG,Incorrect: aum-(Ownership:0 Profile: None) eaum-(Ownership:0 Profile: None) ,
05FWG7-E,Morgan Stanley Investment Management Ltd., ,
07HQLY-E,Morgan Stanley Private Wealth Management Ltd.,Incorrect: style-(Ownership:None Profile: ) ,
07NXRP-E,Morgan Stanley Smith Barney LLC, ,
0BTK0H-E,Morningstar Investment Management Europe Ltd., ,
00716H-E,Morningstar Investment Services LLC, ,
0C3GXP-E,Mount Yale Investment Advisors LLC, ,
0CVJFW-E,"Mountain Capital Investment Advisors, Inc.", ,
05NKQ7-E,NBG Asset Management MFMC, ,
0716LY-E,NCB Capital Co., ,
002T1W-E,NFJ Investment Group LLC, ,
05VZ3N-E,"NN Investment Partners (Japan) Co., Ltd.",,
05WQMH-E,NTV Asset Management LLC, ,
05SJMM-E,"Nan Shan Life Insurance Co., Ltd.", ,
0011HZ-E,National Penn Investors Trust Co.,,
0071Y5-E,National Planning Corp.,Incorrect: style-(Ownership:None Profile: ) ,
009TC5-E,Nationwide Fund Advisors, ,
00D157-E,Nelson Roberts Investment Advisors LLC, ,
002GTQ-E,"New England Asset Management, Inc.", ,
05NHGV-E,"New England Research & Management, Inc.", ,
003R12-E,New England Securities Corp.,Incorrect: style-(Ownership:None Profile: ) ,
0090PP-E,Newbrook Capital Advisors LP, ,
06W61H-E,"Newman Dignan & Sheerar, Inc.", ,
000RBG-E,"Nicholas Co., Inc.", ,
0090YC-E,Nicholas Investment Partners LP, ,
05LGTQ-E,"Nikko Asset Management Americas, Inc.", ,
00FC86-E,Nine Chapters Capital Management LLC,,
075BL1-E,Nomura Asset Management Taiwan Ltd, ,
065FYY-E,Nordea PTE SA,,
072NK6-E,Northern Light Management AB, ,
0C2JMY-E,Northstar Wealth Partners LLC, ,
00B130-E,Northwest Investment Counselors LLC, ,
0GMS3Y-E,Novum Asset Management AG, ,
00C84T-E,Nuance Investments LLC, ,
002G5X-E,Numeric Investors LLC, ,
05JBJD-E,Nykredit Bank A/S (Investment Management), ,
0C78VP-E,O'Brien Wealth Partners LLC,Incorrect: aum-(Ownership:581 Profile: 571) eaum-(Ownership:147.693048 Profile: 86) ,
085J7L-E,OKOWORLD LUX SA, ,
076WQ2-E,OTA LLC, ,
001YD6-E,OZ Management LP, ,
05S5L2-E,"Oarsman Capital, Inc.", ,
05PQHF-E,Oasis Asset Management Ltd., ,
05YNCT-E,Obermeyer Asset Management LLC,Incorrect: style-(Ownership:None Profile: ) ,
0HCKYR-E,Odd Asset Management Ltd., ,
075MTD-E,"Okasan Asset Management Co., Ltd.", ,
0DLWQM-E,Old Republic International Corp. (Investment Management), ,
0G2DF5-E,Oliver Luxxe Assets LLC, ,
06F2CJ-E,One Capital Management LLC, ,
07TCC6-E,Orbis Investment Management (US) LLC, ,
001DGK-E,Orbis Investment Management Ltd., ,
00D1G3-E,Orbitronix LP,,
0BGB17-E,Oskie Capital Management LLC,,
061PG5-E,Ospraie Management LLC,,
075NT7-E,OxFORD Asset Management LLP, ,
002G77-E,"P. J. Schmidt Investment Management, Inc.", ,
0CXW0S-E,PDT Partners LLC, ,
07C73R-E,PGIM Securities Investment Trust Co. Ltd., ,
0DV738-E,Pacad Investment Ltd., ,
004W62-E,Pacific Alternative Asset Management Co. LLC, ,
05FDPK-E,Pacific Investment Management Co. LLC, ,
05W3R7-E,Palatine Asset Management SA, ,
0CJMJK-E,Palestra Capital Management LLC, ,
0CR8CV-E,Palladiem LLC,,
00BQTG-E,Palladium Partners LLC, ,
002HMF-E,Paloma Partners Management Co., ,
002J3K-E,Para Advisors LLC,,
0C2S99-E,Paradigm Financial Advisors LLC, ,
0C2F5B-E,Paragon Capital Management Ltd., ,
00DL0S-E,Parametrica Management Ltd., ,
0CVB42-E,Parasol Investment Management LLC,,
0FGHTG-E,Park Avenue Institutional Advisers LLC, ,
06WLGW-E,Parkwood LLC, ,
002H7K-E,"Parsons Capital Management, Inc.", ,
05TYY6-E,PartnerRe Asset Management Corp.,,
0C8JY5-E,Partnervest Advisory Services LLC, ,
05LMKK-E,Passport Capital LLC, ,
0C857V-E,"Peachtree Investment Advisors, Inc.", ,
0C2FXK-E,Peak Asset Management LLC, ,
0FJX37-E,Pegasus Partners Ltd., ,
05KRLF-E,"Pennant Management, Inc.",,
05MPXM-E,Pension Reserves Investment Management Board, ,
06DDM6-E,PensionDanmark A/S, ,
004CBT-E,"People's Securities, Inc.", ,
0C7KQQ-E,"Peregrine Asset Advisers, Inc.", ,
002F4J-E,Perkins Investment Management LLC, ,
05SR0J-E,Pershing LLC, ,
0639C0-E,Pershing Square Capital Management LP, ,
06NZGY-E,Pharus Management SA, ,
0C90HS-E,"Physicians Financial Services, Inc.", ,
05NVJ7-E,Pictet & Cie (Europe) SA, ,
0HFPMQ-E,Pictet Asset Management Ltd. (Italy), ,
005VRG-E,Pine River Capital Management LP, ,
09K27T-E,PineBridge Investments LLC, ,
0091ZV-E,"Pineno Levin & Ford Asset Management, Inc.", ,
0C7Z5F-E,Pinkerton Retirement Specialists LLC, ,
006WL5-E,"Placemark Investments, Inc.",Incorrect: style-(Ownership:None Profile: ) ,
0D8FLK-E,Plymouth Lane Capital Management LLC,,
09H9M4-E,Point72 Asia (Hong Kong) Ltd., ,
0BCTNT-E,PointState Capital LP, ,
0FV7HT-E,Polaris Greystone Financial Group LLC, ,
0CWH11-E,Polaris Wealth Advisers LLC,,
05Q92M-E,Pramerica SGR SpA, ,
0G62ZG-E,Precision Path Capital LP, ,
06FZZY-E,Prelude Capital Management LLC, ,
00365R-E,"Prentiss Smith & Co., Inc.", ,
00DJP1-E,"Price Wealth Management, Inc.", ,
0DDZBH-E,Princeton Alpha Management LP,,
003KYX-E,Princeton Capital Management LLC, ,
06NQWV-E,Principal Asset Management Bhd., ,
05HV73-E,Principal Global Investors (Europe) Ltd., ,
005Q7F-E,Principal Management Corp., ,
06R8YW-E,Private Advisors LLC, ,
002G4S-E,"Private Asset Management, Inc.", ,
06X382-E,"Pro-Financial Asset Management, Inc.",,
003WSK-E,Professionals' Financial - Mutual Funds Inc., ,
007D2J-E,"Proffitt & Goodson, Inc.", ,
006C1Y-E,"Prospera Financial Services, Inc.", ,
05HX1N-E,Putnam Investments Ltd., ,
002HMY-E,"QCI Asset Management, Inc.", ,
003KJW-E,QCM Cayman Ltd., ,
0C17NN-E,Quadrature Capital Ltd., ,
06MW3D-E,Quaero Capital SA, ,
05R32B-E,"Quaker Funds, Inc.", ,
0D8ZZJ-E,QuantRes Asset Management Ltd., ,
00D1CQ-E,Quantbot Technologies LP, ,
0728KV-E,Quantitative Investment Management LLC, ,
00FYX9-E,Quantitative Systematic Strategies LLC, ,
00BQ7S-E,Quotient Investors LLC,,
0049M3-E,"R. G. Niederhoffer Capital Management, Inc.", ,
002LGB-E,R. H. Bluestein & Co., ,
06VZ1N-E,RB&Co. Holdings LLC,Incorrect: aum-(Ownership:0 Profile: None) eaum-(Ownership:3432.602377 Profile: None) ,
05M024-E,"RBC Dominion Securities, Inc.", ,
05G277-E,RCM (UK) Ltd.,Incorrect: style-(Ownership:None Profile: ) ,
0D3M1V-E,"ROSENBERGER , LANGER & CIE Capital Management GmbH", ,
0DZ83N-E,RPG Investment Advisory LLC, ,
0CXV7F-E,RPg Family Wealth Advisory LLC, ,
0C97Z1-E,Raab & Moskowitz Asset Management LLC, ,
05FQ92-E,Rafferty Asset Management LLC, ,
0FJYSX-E,Raritan Valley Capital Management LLC, ,
0DFH8Y-E,Reality Shares Advisors LLC, ,
0CYFLL-E,Redwood Investment Management LLC (California), ,
0D4K8Q-E,Regal Investment Advisors LLC, ,
05HLZK-E,Renta 4 Gestora SGIIC SA, ,
0090NW-E,Rex Capital Advisors LLC, ,
0C82ST-E,"Rezny Wealth Management, Inc.", ,
002HX7-E,"Rice, Hall, James & Associates LLC", ,
05GW04-E,Richelieu Gestion, ,
00DR6L-E,Riley Creek Capital Management LLC,,
0C22RL-E,Risk Paradigm Group LLC, ,
06H7L5-E,River & Mercantile Asset Management LLP, ,
0D21DW-E,RobecoSAM AG, ,
0600Y2-E,"Roble Belko & Co., Inc", ,
05K934-E,"Rotella Capital Management, Inc.",,
06L277-E,Royal Bank of Canada (Suisse) SA,,
05G42Q-E,Royal Bank of Canada Investment Management (UK) Ltd., ,
0D6F62-E,Roystone Capital Management LP, ,
002H7Y-E,Russell Investment Management LLC, ,
05GYML-E,SAL Equity Trading GP,,
00CF6W-E,SAS Capital Management LLC,,
0GXPBG-E,SAYA Management LP, ,
0CXLVP-E,SECOR Capital Advisors LP, ,
05RPN9-E,"SII Investments, Inc.",,
009YQY-E,"SMITH HAYES Advisers, Inc.",,
004GLH-E,SPF Beheer BV, ,
06P0F6-E,SRB Corp., ,
0CV1WT-E,SVA Plumb Wealth Management LLC, ,
0D60Y0-E,Sachem Head Capital Management LP, ,
0C3HH8-E,Sage Capital Advisors LLC, ,
001NGD-E,"Salem Investment Counselors, Inc.", ,
00D17K-E,Salient Capital Advisors LLC, ,
06PCW9-E,Samlyn Capital LLC, ,
05LH63-E,Sampension Administrationsselskab A/S,,
0012MH-E,Sandler Capital Management, ,
007ZYV-E,Santa Fe Partners LLC,,
05FWKW-E,Santander Asset Management UK Ltd., ,
0B82BW-E,Santander Private Banking Gestion SA SGIIC, ,
0C23YH-E,"Santori & Peters, Inc.", ,
00C17P-E,"Sarbit Advisory Services, Inc.", ,
00CG8W-E,"Sawtooth Asset Management, Inc.",Incorrect: style-(Ownership:GARP Profile: None) ,
0G15HV-E,Schonfeld Strategic Advisors LLC, ,
07KFWV-E,Schooner Investment Group LLC,,
0FWWDY-E,Sciencast Management LP, ,
00245B-E,Scoggin Management LP, ,
0080GP-E,Scopus Asset Management LP, ,
0DDB58-E,Scoria Capital Partners LP,,
05G1Y4-E,Sella SGR SpA, ,
00F634-E,Semper Trust Co.,,
079LVS-E,Senator Investment Group LP, ,
001Q4T-E,Seneca Capital Investments LP,,
081WDJ-E,Sensato Investors LLC, ,
0CXR9Y-E,Seven Bridges Advisors LLC, ,
00FZ3W-E,Seven Eight Capital LP, ,
0DQRFF-E,Shigeta Yasumitsu (Investment Portfolio), ,
05SMJ3-E,"Shinko Asset Management Co., Ltd.",,
00723G-E,"Signator Investors, Inc.", ,
0GYLSX-E,Signature Wealth Management Group LLC, ,
0G6GJW-E,Signition LP, ,
002GHS-E,Silver Bridge Capital Management LLC,Incorrect: style-(Ownership:None Profile: ) ,
00D3JM-E,Simplex Trading LLC, ,
075BP8-E,"SinoPac Securities Investment Trust Co., Ltd.", ,
05M3BS-E,Smith Affiliated Capital Corp.,,
002CHW-E,Smith Asset Management Group LP, ,
0H2YG0-E,"Smith, Moore & Co. (Investment Management)", ,
00CDHR-E,"Smith, Salley & Associates LLC", ,
094MHH-E,Societe Generale Gestion SA, turnover-(Ownership:Very Low Profile: Medium) ,
05SVMZ-E,Solaris Asset Management LLC, ,
0CZ2VX-E,Solstein Capital LLC, ,
074XSJ-E,Sonora Investment Management LLC, ,
0BJQXK-E,Sontag Advisory LLC, ,
0B6B7N-E,Soroban Capital Partners LP, ,
001GCK-E,Soros Fund Management LLC, ,
0C6WHQ-E,Source For Alpha (Deutschland) AG, ,
06149J-E,South Dakota Investment Council, ,
05LVY7-E,South Texas Money Management Ltd., ,
002RWC-E,"Sparrow Capital Management, Inc.", ,
0C7SF4-E,"Spectrum Management Group, Inc. (Indiana)", ,
078TQK-E,Sphera Funds Management Ltd., ,
0G5X75-E,"Sphere Investment Management, Inc.",Incorrect: style-(Ownership:None Profile: ) ,
009ZM3-E,SpiderRock Trading LLC,Incorrect: style-(Ownership:None Profile: ) ,
003RQT-E,Spot Trading LLC,Incorrect: aum-(Ownership:0 Profile: None) ,
0F1W43-E,Squarepoint OPS LLC, ,
007305-E,Stadion Money Management LLC, ,
09JKR1-E,"StanCorp Investment Advisers, Inc.",,
0CY9PL-E,Stanlib Multi-Manager Ltd., ,
0049B4-E,Steadfast Capital Management LP, ,
06VSK4-E,Stelliam Investment Management LP, ,
0F1W7K-E,Sterling Global Strategies LLC, ,
0DDRX5-E,Sterling Ridge Capital Management LP,,
05K084-E,"Sterne Agee Asset Management, Inc.",,
0035QZ-E,Stevens Capital Management LP, ,
0FDDTQ-E,Stillwater Investment Management LP,,
0011RH-E,Stock Yards Bank & Trust Co., ,
0C7RYL-E,Strategic Capital Alternatives LLC,,
00BPQ7-E,"Strategic Financial Services, Inc. (New York)", ,
002HHG-E,Strategic Investment Management LLC, ,
002GXG-E,Stratton Management Co.,,
0DLBR3-E,Sturgeon Ventures LLP, ,
007BH6-E,Stux Capital Management LLC,Incorrect: style-(Ownership:None Profile: ) ,
0CX61T-E,Sumit Capital LLC,,
05SX63-E,"Sumitomo Mitsui Asset Management Co., Ltd.", ,
00FBN9-E,Summit Securities Group LLC, ,
0024VP-E,Sun Life Institutional Investments (US) LLC, ,
007R6M-E,"SunTrust Investment Services, Inc.",,
0GGXJB-E,Sungarden Fund Management LLC, ,
003RRD-E,Susquehanna Financial Group LLLP, ,
00496Q-E,Susquehanna Investment Group LLC, ,
0C71LH-E,Suvretta Capital Management LLC, ,
075Z9Y-E,Swiss Life Asset Management (France) SA, ,
05FWLY-E,Swisscanto Fondsleitung AG, ,
002HP4-E,Symphony Asset Management LLC, ,
06QT6J-E,"Synovus Securities, Inc.", ,
0CR285-E,Syntal Capital Partners LLC, ,
002MDL-E,Systematic Financial Management LP, ,
0078M6-E,T2 Partners Management LP,,
05WT83-E,TBF Global Asset Management GmbH, ,
006S3D-E,TD Securities (USA) LLC,,
002LK1-E,"TDAM USA, Inc.", ,
006LKT-E,TFS Capital LLC,,
0BMWRY-E,THEAM SAS,,
002NY9-E,"TIAA-CREF Trust Co., FSB",,
0DTRZ3-E,TPG PEP Advisors LLC, ,
07FJH4-E,Tamir Fishman Mutual Funds Ltd., ,
0DMK17-E,Taylor Wealth Management Partners LLC, ,
002LY6-E,Teacher Retirement System of Texas, ,
06G452-E,Telemetry Investments LLC, ,
007GTR-E,Telluride Asset Management LLC,,
001D77-E,Temasek Holdings Pte Ltd. (Investment Management), ,
002KNN-E,Templeton Asset Management Ltd. (Hong Kong), ,
061VDT-E,"Texas Capital Bancshares, Inc. (Investment Management)", ,
0FJWF8-E,Teza Capital Management LLC, ,
002HQM-E,The Ayco Co. LP, ,
05FVV7-E,The Leuthold Group LLC (Investment Management), ,
0GWRFZ-E,The Patriot Financial Group Insurance Agency LLC, ,
00GM9C-E,"The Patten Group, Inc.", ,
005HYK-E,The PrivateBank & Trust Co. (Investment Management), ,
05LWBP-E,The Rock Creek Group LP, ,
05JK5T-E,"The Roosevelt Investment Group, Inc.", ,
09NXFY-E,The TLP Group LLC, ,
0D2PLG-E,The Trust Co. (Kansas), ,
002JD5-E,The Trust Company of Oklahoma, ,
07MX56-E,Thomasville National Bank (Invt Mgmt), ,
05NFLH-E,"Thompson Davis & Co., Inc.", ,
00104F-E,"Thornburg Investment Management, Inc.", ,
05HPS9-E,"Thornmark Asset Management, Inc.",,
0GF9PC-E,Thorntree Capital Partners LP, ,
0BQC95-E,Thrivent Asset Management LLC, ,
0DYG2Y-E,Thrivent Financial for Lutherans (Investment Portfolio), ,
0CN2KP-E,Tide Point Capital Management LP, ,
07NCT7-E,Tiger Eye Capital LLC, ,
004G3S-E,Timber Hill LLC, ,
05SJYC-E,"Tokio Marine Asset Management Co., Ltd.", ,
0H4550-E,"Tompkins Wealth Management, Inc.", ,
06VDTG-E,Tower Trust Co.,,
073NKT-E,TradeLink Capital LLC, ,
07JJ9W-E,Tradewinds Capital Management LLC, ,
0090RF-E,"Tradeworx, Inc.",,
008C5Q-E,"Transamerica Financial Advisors, Inc.", ,
0BK87R-E,Trea Asset Management SGIIC SA, ,
002XJJ-E,Trees Investment Counsel LLC,,
0080JT-E,Tremblant Capital LP, ,
002LRN-E,"Trevor Stewart Burton & Jacobsen, Inc.",,
0DVFWG-E,Trexquant Investment LP, ,
065KX7-E,Triglav Skladi doo, ,
