FactSet Entity ID,Institution_name,Discrepancy_Column,
002FYS-E,"The Vanguard Group, Inc.",Incorrect: aum-(Ownership:4530139 Profile: 4839296) eaum-(Ownership:2539168.520537 Profile: 3136824) ,
000WWX-E,State Farm Investment Management Corp.,,67
05J8D9-E,State Street Global Advisors (SSgA),,
08D3XB-E,BlackRock Fund Advisors,Incorrect: aum-(Ownership:5400000 Profile: None),
000TNX-E,"T. Rowe Price Associates, Inc. (Investment Management)",,
000CM9-E,"Barrow, Hanley, Mewhinney & Strauss LLC",,
0013BR-E,GIC Pte Ltd. (Investment Management),,
0D5G47-E,Capital Research & Management Co. (International Investors),,
05F9M2-E,"Franklin Advisers, Inc.",,
000Q6S-E,"JPMorgan Investment Management, Inc.",,
05J871-E,"Northern Trust Investments, Inc.(Investment Management)",,
009SF1-E,Managed Account Advisors LLC,,
0D3J68-E,Wells Fargo Clearing Services LLC,,
0049LH-E,Geode Capital Management LLC,,
002HTK-E,Henderson Global Investors Ltd.,,
06NPXD-E,Capital Research & Management Co. (World Investors),,
05K75W-E,Findlay Park Partners LLP,,
07NMMQ-E,Neuberger Berman Investment Advisers LLC,,
05FGHP-E,Principal Global Investors LLC,,
06KMJB-E,BlackRock Investment Management (UK) Ltd.,,
000KLZ-E,Fidelity Management & Research Co.,Incorrect: aum-(Ownership:2000000 Profile: None) eaum-(Ownership:752007.284198 Profile: 876419) turnover-(Ownership:Low Profile: Very Low) ,
05F9JR-E,Mellon Investments Corp.,,
077CYS-E,"Bank of America, NA (Private Banking)",,
002HJB-E,BlackRock Advisors LLC,,
09Q5CD-E,Columbia Management Investment Advisers LLC,,
0DCX79-E,DWS Investment GmbH,,
002G6D-E,"Bahl & Gaynor, Inc.",,
0D9L9X-E,"Raymond James & Associates, Inc. (Invt Mgmt)",,
05J6LL-E,Legal & General Investment Management Ltd.,,
06BJ1G-E,ClearBridge Investments LLC,Incorrect: aum-(Ownership:130388 Profile: 142148) eaum-(Ownership:115199.663867 Profile: 113894) ,
05J6S2-E,The Bank of New York Mellon Corp. (Investment Management),,
05TP21-E,Invesco Capital Management LLC,,
000HJ9-E,Dimensional Fund Advisors LP,,
000BQ0-E,"Fred Alger Management, Inc.",,
001XJ8-E,OMERS Administration Corp.,,
002HXG-E,"Charles Schwab Investment Management, Inc.",,
08GP1D-E,BlackRock Advisors (UK) Ltd.,,
002HPC-E,TIAA-CREF Investment Management LLC,,
000NVY-E,Luther King Capital Management Corp.,,
005GXL-E,Luminus Management LLC,,
05QBT3-E,"Nikko Asset Management Co., Ltd.",,
002H53-E,Voya Investment Management Co. LLC,,
002HL1-E,"Invesco Advisers, Inc.",,
0D8XX0-E,Schweizerische Nationalbank (Investment Portfolio),,
05M9G5-E,"JPMorgan Chase Bank, NA (Investment Management)",,
0GB4MX-E,Morgan Stanley Smith Barney LLC (Invt Mgmt),,
002C2Z-E,"American Century Investment Management, Inc.",,
06L8XD-E,BlackRock Investment Management LLC,,
002K96-E,Putnam Investment Management LLC,,
05FDPL-E,Parametric Portfolio Associates LLC,,
001Y83-E,Bessemer Investment Management LLC,,
002J4D-E,Fayez Sarofim & Co.,,
09YDZ6-E,Cincinnati Financial Corp. (Investment Portfolio),,
000FF4-E,Credit Suisse Securities (USA) LLC (Broker),,
00DJSZ-E,Glenhill Capital Advisors LLC,,
0603C7-E,Empyrean Capital Partners LP,,
0D8QQB-E,"Raymond James Financial Services Advisors, Inc.",,
002JYR-E,The Haverford Trust Co.,,
00CTKX-E,"TPG Group Holdings (SBS) Advisors, Inc.",,
089DR7-E,"BlackRock Financial Management, Inc.",,
001BC5-E,"UBS Financial Services, Inc.",,
002B3Q-E,New York State Common Retirement Fund,,
002CDB-E,First Trust Advisors LP,,
002HP5-E,Teachers Advisors LLC,,
002K0M-E,Goldman Sachs Asset Management LP,,
001RLW-E,"John W. Bristol & Co., Inc. (New York)",,
0084HS-E,ProShare Advisors LLC,,
05HCR0-E,1832 Asset Management LP,,
05KFYG-E,Norges Bank Investment Management,,
0CFF4J-E,"Merrill Lynch, Pierce, Fenner & Smith, Inc. (Invt Mgmt)",,
002HYD-E,"Wells Capital Management, Inc.",,
0031SR-E,RhumbLine Advisers LP,,
002FTH-E,M&G Investment Management Ltd.,,
05FW7Z-E,JPMorgan Asset Management (UK) Ltd.,,
001NBV-E,"PNC Bank, NA (Investment Management)",,
00FC5V-E,Green Valley Investors LLC,,
001LWQ-E,"Fenimore Asset Management, Inc.",,
05V7SP-E,Barclays Bank Plc (Private Banking),,
06RK8Z-E,Marble Arch Investments LP,,
00GLD1-E,Roundwood Asset Management LLC,,
05G7NS-E,Robeco Institutional Asset Management BV,,
0DLBGG-E,Vanguard Global Advisers LLC,,
000D7G-E,The California Public Employees Retirement System,,
0D58B0-E,Invesco Investment Advisers LLC,,
001ZHV-E,"TD Asset Management, Inc.",,
000WX0-E,State of Wisconsin Investment Board,,
060DTF-E,"Mirae Asset Global Investments Co., Ltd.",,
05F9FS-E,AllianceBernstein LP,,
002DRR-E,California State Teachers' Retirement System,,
05K57N-E,Tennessee Consolidated Retirement System,,
002XSZ-E,"Rothschild & Co. Asset Management US, Inc.",,
002J01-E,Congress Asset Management Co. LLP,,
06WRQY-E,National Pension Service of Korea,,
05FWL8-E,UBS AG (Investment Management),,
006WTM-E,QMA LLC,,
000HPH-E,BNY Mellon Investment Adviser Inc.,,
002V15-E,"Bridgeway Capital Management, Inc.",,
060K8R-E,Calamos Advisors LLC,,
0DCFD3-E,Goldman Sachs & Co. LLC (Private Banking),,
00724F-E,Wells Fargo Advisors Financial Network LLC,,
002XTV-E,UBS Asset Management (UK) Ltd.,,
002BRP-E,State Board of Administration of Florida Retirement System,,
002HLW-E,"Regions Investment Management, Inc.",,
00BZN0-E,Freshford Capital Management LLC,,
000R9G-E,New York State Teachers Retirement System,,
0FB3YK-E,Merrill Lynch International (Investment Management),,
003HVP-E,Adage Capital Management LP,,
06KTBZ-E,Close Asset Management Ltd.,,
000SX3-E,"OppenheimerFunds, Inc.",,
008JVS-E,myCIO Wealth Partners LLC,,
00DXXK-E,USAA Asset Management Co.,,
002J1N-E,NNIP Advisors BV,,
05G784-E,HSBC Global Asset Management (UK) Ltd.,,
002JKF-E,D. E. Shaw & Co. LP,,
0D7C6T-E,"Wells Fargo Bank, NA (Private Banking)",,
08DLP8-E,BlackRock Asset Management Canada Ltd.,,
001091-E,Cramer Rosenthal McGlynn LLC,,
0CQD0W-E,Montag & Caldwell LLC,,
0FM5MX-E,NN Investment Partners BV,,
001T29-E,"Conning, Inc.",,
002J5V-E,"Zacks Investment Management, Inc.",,
05G79W-E,Nordea Investment Management AB (Denmark),,
06069X-E,Sarasin & Partners LLP,,
002KQD-E,Davenport & Co. LLC,,
05FBK7-E,Morgan Stanley & Co. LLC,,
05JK9P-E,Sjunde AP-fonden,,
05G027-E,1919 Investment Counsel LLC,,
06TMWC-E,Natixis Investment Managers International SA,,
000D1Q-E,UBS Asset Management (Americas) Inc.,,
05FYYC-E,Deka Investment GmbH,,
06G51K-E,Visium Asset Management LP,,
05GH73-E,Saturna Capital Corp.,,
07HQ1Z-E,HighTower Advisors LLC,,
008KTT-E,Mariner LLC,,
05PG7S-E,Aperio Group LLC,,
09R82Y-E,AMF Fonder AB,,
05J6QK-E,"Los Angeles Capital Management & Equity Research, Inc.",,
05GSG8-E,Threadneedle Asset Management Ltd.,,
0035TM-E,UBS O'Connor LLC,,
0035PV-E,Tewksbury Capital Management Ltd.,,
06327D-E,Mitsubishi UFJ Trust & Banking Corp. (Investment Management),,
0H2Y8N-E,JPMorgan Securities LLC (Investment Management),,
05HPH0-E,GWL Investment Management,,
002XR7-E,Chevy Chase Trust Co.,,
0020GL-E,Vanguard Fiduciary Trust Co.,,
004Z9Q-E,Citadel Advisors LLC,,
0645TX-E,"Envestnet Asset Management, Inc.",,
002Y4H-E,UBS Securities LLC,,
05HT6V-E,New Jersey Division of Investment,,
05MBX1-E,"KeyBank, NA (Investment Management)",,
086TRK-E,PNC Capital Advisors LLC,,
003LBB-E,AQR Capital Management LLC,,
00D1FG-E,Two Sigma Advisers LP,,
05FW98-E,Lyxor International Asset Management SAS,,
05FRVG-E,"QS Batterymarch Financial Management, Inc.",,
002BSH-E,Eaton Vance Management,,
0C238L-E,Donaldson Capital Management LLC,,
002HYJ-E,Wilmington Trust Investment Management LLC,,
069316-E,DWS Investments (UK) Ltd.,,
0DB9DH-E,Manulife Asset Management Ltd.,,
05G2B9-E,Kames Capital Plc,,
000KN8-E,BMO Asset Managers Ltd.,,
002TPV-E,Strategic Advisers LLC,,
06F5NK-E,RBC Capital Markets LLC (Investment Management),,
001JJ6-E,"Kornitzer Capital Management, Inc.",,
002JMH-E,"Boston Trust Investment Management, Inc.",,
05G31Z-E,Investec Asset Management Ltd.,,
002LQK-E,Boston Financial Management LLC,,
08BZBV-E,"BlackRock Japan Co., Ltd.",,
05KFM2-E,Goldman Sachs & Co. LLC,,
05KYGK-E,INTECH Investment Management LLC,,
05HZVB-E,Leith Wheeler Investment Counsel Ltd.,,
0010RD-E,Westfield Capital Management Co. LP,,
00479N-E,Dearborn Partners LLC,,
001T5F-E,State Teachers Retirement System of Ohio,,
0011MX-E,Glenmede Investment Management LP,,
0C2NT4-E,Allianz Investment Management LLC,,
001YT0-E,Ohio Public Employees Retirement System,,
05JZ8Y-E,Mariner Wealth Advisors-Cincinnati LLC,,
05FBN4-E,Coutts & Co.,,
05GRNK-E,"ClearArc Capital, Inc.",,
0BJ0LD-E,"RBC Global Asset Management, Inc.",,
002J5L-E,Waddell & Reed Investment Management Co.,,
07MY7Y-E,Korea Investment Corp. (Investment Management),Incorrect: aum-(Ownership:134100 Profile: 131600) eaum-(Ownership:22254.573388 Profile: 23617) ,
0DFMYG-E,BMO Asset Management Corp., ,
0GS2R4-E,"Citigroup Global Markets, Inc. (Investment Management)", ,
09N7PK-E,Allianz Global Investors U.S. LLC, ,
0GVFHN-E,Glen Harbor Capital Management LLC, ,
0G4YRB-E,Adams Funds Advisers LLC, ,
05GSFD-E,KLP Kapitalforvaltning AS, ,
05FP7K-E,Nordea Investment Management AB (Norway), ,
05JR08-E,"Sentry Investments, Inc.",,
05F9FV-E,AXA Rosenberg Investment Management LLC, ,
002HNF-E,"Citigroup Global Markets, Inc. (Broker)", ,
06QBDB-E,Mn Services Vermogensbeheer BV, ,
0DLBVB-E,Pictet Asset Management (Singapore) Pte Ltd., ,
001MTF-E,Comerica Bank (Investment Management Texas), ,
06DB7L-E,FIAM LLC, ,
003LHX-E,Ascend Capital LLC, ,
00BDK5-E,Confluence Investment Management LLC, ,
0D2CW0-E,BB&T Securities LLC, ,
0606CR-E,Vanguard Investments Australia Ltd., ,
0DZXVN-E,Boston Private Wealth LLC, ,
002HBH-E,"Douglas C. Lane & Associates, Inc.",,
05G9B9-E,Danske Capital AB,,
0DMSKN-E,"Stifel Nicolaus & Co., Inc. (Investment Management)", ,
002H7B-E,Natixis Advisors LP, ,
0644CQ-E,London & Capital Asset Management Ltd., ,
0FG27B-E,"Associated Trust Co., N.A. (Wisconsin)", ,
0GVFFN-E,Meadow Creek Investment Management LLC, ,
00BR1V-E,SIR Capital Management LP, ,
05KQW8-E,The Retirement Systems of Alabama, ,
05FW5X-E,BNP Paribas Asset Management France SAS, ,
001YWB-E,Virginia Retirement Systems, ,
002G69-E,Advanced Investment Partners LLC,Incorrect: style-(Ownership:None Profile: ) ,
0D6XTK-E,Claar Advisors LLC, ,
06DYV7-E,ClariVest Asset Management LLC, ,
002L1Q-E,"Fiera Capital, Inc.", ,
002PWD-E,Horizon Kinetics Asset Management LLC, ,
05FW7K-E,La Banque Postale Asset Management SA, ,
07KW7X-E,"Legal & General Investment Management America, Inc.", ,
000P8J-E,"Loomis, Sayles & Co. LP", ,
002J41-E,Renaissance Technologies LLC, ,
072PPF-E,Riskmetrics Group (UK) Ltd.,Incorrect: style-(Ownership:None Profile: ) ,
09W4JX-E,SeaTown Holdings International Pte Ltd., ,
002GGR-E,Sentry Investment Management LLC, ,
05K28L-E,State Street Global Advisors Ltd., ,
066ZJJ-E,Tributary Capital Management LLC, ,
05PW4T-E,Grandfield & Dodd LLC, ,
05H9LL-E,"BMO Asset Management, Inc.", ,
002H3C-E,Martin Currie Investment Management Ltd., ,
00179W-E,Mackenzie Financial Corp., ,
0088TN-E,"Willis Investment Counsel, Inc.", ,
001JWR-E,SunAmerica Asset Management LLC,Incorrect: aum-(Ownership:79200 Profile: 69135) eaum-(Ownership:26455.597742 Profile: 28149) ,
003G7H-E,"US Bancorp Asset Management, Inc.", ,
001L2N-E,Artisan Partners LP, ,
002M0F-E,"S & Co., Inc.", ,
094MG7-E,Amundi Asset Management SA (Investment Management), ,
05L9XV-E,PGGM Vermogensbeheer BV, ,
001J5S-E,The Park National Bank (Investment Management), ,
06JN4W-E,BNP Paribas Arbitrage SNC, ,
075SG7-E,"Robert W. Baird & Co., Inc. (Private Banking)", ,
00CF8F-E,KBC Fund Management Ltd., ,
05KBWD-E,Fideuram Asset Management (Ireland) DAC, ,
002JLB-E,Royal London Asset Management Ltd., ,
0DHGV8-E,Storebrand Asset Management AS, ,
06PMGQ-E,BlackRock Investment Management (Australia) Ltd., ,
0034KK-E,Eastern Bank Corp. (Private Banking), ,
05LT39-E,Pacific Heights Asset Management LLC, ,
0BG58Q-E,Talara Capital Management LLC, ,
0618KM-E,Employees Retirement System of Texas, ,
06MV32-E,Allianz Global Investors GmbH, ,
05HQ7S-E,Guardian Capital LP, ,
05G6QK-E,Aviva Investors Global Services Ltd., ,
0GV73Z-E,Elkfork Partners LLC, ,
00128H-E,Fiduciary Trust Co. International, ,
0C7L0Q-E,"Youngs Advisory Group, Inc.", ,
002P7T-E,"Williams, Jones & Associates LLC", ,
002J7T-E,Schroder Investment Management Ltd., ,
002HLZ-E,NISA Investment Advisors LLC, ,
003XST-E,Boston Private Bank & Trust Co.,Incorrect: style-(Ownership:GARP Profile: None) ,
006F31-E,DWS International GmbH, ,
0CLQ91-E,CIBC World Markets Corp., ,
0011Y4-E,"M. D. Sass Investors Services, Inc.", ,
006X6W-E,Taurus Asset Management LLC, ,
00BQT2-E,Arrowgrass Capital Partners (US) LP, ,
0044WZ-E,SEI Investments Management Corp., ,
002G53-E,Tocqueville Asset Management LP, ,
06JZJ9-E,Alberta Investment Management Corp., ,
05FQH7-E,Pennsylvania Trust Co., ,
001XT4-E,"DWS Investment Management Americas, Inc.", ,
002H63-E,The First National Bank of Omaha (Investment Management), ,
0FJXBY-E,William Blair Investment Management LLC, ,
05TZ2D-E,British Airways Pension Investment Management Ltd., ,
000P8M-E,"Lord, Abbett & Co. LLC", ,
0DF533-E,"Adams Natural Resources Funds, Inc. (Invt Mgmt)", ,
0032R9-E,Argent Capital Management LLC, ,
09P8C5-E,BNP PARIBAS ASSET MANAGEMENT Netherlands NV, ,
002DDZ-E,"Fortis Investment Management USA, Inc.", ,
066XHG-E,Marshall Wace North America LP, ,
05WSYW-E,"Brinker Capital, Inc.", ,
00566B-E,Northern Trust Global Investments Ltd., ,
09ZTH9-E,Brown Advisory LLC, ,
05HP6D-E,AMP Capital Investors Ltd., ,
0056DF-E,"Piedmont Investment Advisors, Inc.", ,
003L6Z-E,"Chesley, Taft & Associates LLC", ,
0DKM72-E,Michigan Department of Treasury (Investment Management), ,
0035V5-E,Charles D. Hyman & Co., ,
002J0K-E,Fiduciary Trust Co., ,
05FW8P-E,CPR Asset Management SA, ,
00DFPF-E,MetLife Investment Management LLC, ,
05FY8L-E,"Union Bank & Trust Co. (Lincoln, Nebraska)", ,
05ZYBJ-E,Barclays Capital Securities Ltd., ,
0CJ46C-E,"RBC Dominion Securities, Inc. (Investment Management)", ,
002J6Y-E,Heritage Investors Management Corp., ,
002KFZ-E,"Halsey Associates, Inc.", ,
06M2R5-E,Pictet Asset Management SA, ,
0DG29L-E,Picton Mahoney Asset Management, ,
000HGT-E,Delaware Investment Management Business Trust, ,
05NLNX-E,BC Investment Management Corp., ,
0GVFFW-E,Tyers Asset Management LLC, ,
002HBD-E,"Jacobs Levy Equity Management, Inc.", ,
002JHW-E,Sterling Capital Management LLC, ,
061863-E,Arizona State Retirement System, ,
05J87Y-E,Peapack-Gladstone Bank (Investment Management), ,
05FVNC-E,"Colonial Trust Advisors, Inc.", ,
0DF53F-E,"The Adams Diversified Equity Fund, Inc. (Mutual Fund Manager)", ,
05J6JS-E,Nissay Asset Management Corp., ,
05LLK7-E,"Dana Investment Advisors, Inc.", ,
003JQW-E,Trust Company of Vermont, ,
0CVX5Y-E,"BlackRock Capital Management, Inc.", ,
0GXRGX-E,Sandbar Asset Management LLP, ,
006ZH9-E,"Advisors Asset Management, Inc.", ,
000PC4-E,MacKay Shields LLC, ,
002M3D-E,The Boston Family Office LLC, ,
05SG74-E,"Asset Management One Co., Ltd.", ,
009S80-E,"First Republic Investment Management, Inc.", ,
06T5YJ-E,Zurcher Kantonalbank (Investment Management), ,
002XCH-E,KCM Investment Advisors LLC, ,
05HDRF-E,Healthcare of Ontario Pension Plan,,
05G36K-E,Gulf International Bank (UK) Ltd., ,
001LWB-E,Welch & Forbes LLC, ,
060YMK-E,Millennium Management LLC, ,
001HBR-E,First Manhattan Co., ,
06Q5HR-E,"Decatur Capital Management, Inc.", ,
089TX3-E,Insiderfonder AB, ,
002HHQ-E,"RBC Global Asset Management (US), Inc.", ,
05GVFN-E,Swedbank Robur Fonder AB, ,
002H3S-E,"Nomura Asset Management Co., Ltd.", ,
002LG5-E,Analytic Investors LLC, ,
05G6HN-E,SEB Investment Management AB, ,
002G7V-E,"Dillon & Associates, Inc.", ,
002M15-E,Trillium Asset Management LLC, ,
009ND6-E,KBC Asset Management NV, ,
002H43-E,"PanAgora Asset Management, Inc.", ,
00577F-E,Gabelli Funds LLC, ,
001ZF3-E,Aberdeen Asset Managers Ltd., ,
001JZX-E,Brown Brothers Harriman & Co. (Investment Management), ,
0618D7-E,Zurich Life Assurance Plc, ,
05G643-E,Credit Suisse AG, ,
000BPX-E,APG Asset Management NV, ,
05V81C-E,ACTIAM NV, ,
06Q1B4-E,BlackRock (Singapore) Ltd., ,
002HDZ-E,"Henry H. Armstrong Associates, Inc.", ,
05FWLZ-E,Aberdeen Asset Investments Ltd., ,
0C90JQ-E,Nixon Peabody Financial Advisors LLC, ,
0DDLFQ-E,Janney Montgomery Scott LLC (Investment Management), ,
05G3L9-E,Raiffeisen Kapitalanlage-Gesellschaft mbH, ,
004F37-E,Texas Permanent School Fund, ,
0090PS-E,"Patriot Wealth Management, Inc.", ,
00907S-E,Reilly Financial Advisors LLC, ,
0DYG4K-E,The Northwestern Mutual Life Insurance Co. (Invt Port), ,
05GNGN-E,"Wilmington Trust Investment Advisors, Inc.", ,
05JJ9M-E,Fjarde AP-fonden, ,
05K31K-E,The Norinchukin Bank (Investment Management), ,
0C7SBR-E,Brightworth LLC, ,
005GHN-E,"Oppenheimer Asset Management, Inc.", ,
0032WN-E,DuPont Capital Management Corp., ,
05RK9D-E,Utah Retirement Systems, ,
009X9F-E,Renaissance Investment Group LLC, ,
001MJ6-E,Colorado Public Employees' Retirement Association, ,
0080MP-E,"Lockwood Advisors, Inc.", ,
000XKH-E,TCW Asset Management Co. LLC, ,
05K8QH-E,JPMorgan International Bank Ltd., ,
07HKTT-E,Federated Global Investment Management Corp., ,
002J23-E,"Loring, Wolcott & Coolidge Fiduciary Advisors LLP", ,
05FYG9-E,Vontobel Asset Management AG, ,
0DX2RS-E,"Investec Asset Management North America, Inc.", ,
002HVY-E,Meyer Handelman Co. LLC, ,
00G8LL-E,EOS Focused Equity Management LP, ,
0GMWYQ-E,Calvert Research & Management, ,
05HPFF-E,Canada Pension Plan Investment Board, ,
00B346-E,LPL Financial LLC, ,
0021HG-E,Chartwell Investment Partners LLC, ,
008Z3V-E,Marble Harbor Investment Counsel LLC, ,
0FYZK3-E,Xact Kapitalforvaltning AB, ,
06DQ8L-E,Stephens Investment Management Group LLC, ,
0G67J4-E,Steward Partners Investment Advisory LLC, ,
05GSK4-E,DNB Asset Management AS, ,
05VHVJ-E,Lazard Asset Management LLC, ,
05T76G-E,"Penobscot Investment Management Co., Inc.", ,
0090LS-E,Richard C. Young & Co. Ltd., ,
0048PD-E,Shell Asset Management Company BV, ,
05J6Y6-E,Commerce Bank (Investment Management), ,
002P1V-E,"Opus Investment Management, Inc.", ,
0C8QKB-E,Herbert Faulkner Reilly III (Investment Management), ,
001JQG-E,WEDGE Capital Management LLP, ,
008K3J-E,Alaska Retirement Management Board, ,
00BQTC-E,LS Investment Advisors LLC, ,
002FQB-E,F.L. Putnam Investment Management Co., ,
002JJ1-E,Woodstock Corp., ,
0071ZN-E,"Commonwealth Equity Services, Inc.", ,
0025QG-E,Old National Bank (Investment Management), ,
002P34-E,The Caisse de depot et placement du Quebec, ,
002JMT-E,"Bradley, Foster & Sargent, Inc.", ,
0GCKCQ-E,"Franklin, Parlapiano, Turner & Welch LLC", ,
05M4WB-E,"Tower Bridge Advisors, Inc.", ,
003QZ9-E,"Goelzer Investment Management, Inc.", ,
06Z4N0-E,Guggenheim Partners Investment Management LLC, ,
002HWY-E,"Pittenger & Anderson, Inc.", ,
000RGG-E,Mason Street Advisors LLC, ,
003LJ0-E,"Bragg Financial Advisors, Inc.", ,
002VK6-E,Walter Scott & Partners Ltd., ,
00B0TT-E,WealthTrust Fairport LLC, ,
07JGRK-E,Cornerstone Capital Management Holdings LLC,,
05K5TW-E,Sanlam Investment Management (Pty) Ltd., ,
0DDBDX-E,Metropolitan Life Insurance Co. (Investment Portfolio), ,
0684CV-E,"Mitsubishi UFJ Kokusai Asset Management Co., Ltd.", ,
002LL2-E,Kanawha Capital Management LLC, ,
002H3Q-E,Mutual of America Capital Management LLC, ,
08756C-E,Fidelity (Canada) Asset Management ULC, ,
002KM8-E,"Victory Capital Management, Inc.(Investment Management)", ,
00D6GY-E,"American National Registered Investment Advisor, Inc.", ,
05ZP03-E,Dimensional Fund Advisors Ltd., ,
0J0WX8-E,JGP Wealth Management LLC, ,
002HJ2-E,Amalgamated Bank (Investment Management), ,
0JD1LK-E,CX Institutional LLC, ,
0DJQBS-E,"Oppenheimer & Co., Inc. (Wealth Management)", ,
002HTL-E,"Hendley & Co., Inc.", ,
002GTZ-E,"Johnson Investment Counsel, Inc.", ,
002H2Z-E,Hartford Investment Management Co., ,
007RWM-E,TBFM LLP, ,
066NC4-E,"Haverford Financial Services, Inc.", ,
001PBJ-E,"Eagle Asset Management, Inc.", ,
0019KF-E,"CIBC Asset Management, Inc.", ,
0GK52S-E,"BB&T Institutional Investment Advisers, Inc.", ,
05JJC2-E,Forsta AP-fonden, ,
002SMY-E,Pillar Pacific Capital Management LLC, ,
0BG6YQ-E,Richard Bernstein Advisors LLC, ,
0C7BVB-E,"Commerce Investment Advisors, Inc.", ,
074MK0-E,Broadway National Bank Asset Management, ,
0JZRF0-E,"Andesa Financial Management, Inc.", ,
081WGM-E,"BOKF, NA", ,
05NSRR-E,"A.N. Culbertson & Co., Inc.", ,
003LHZ-E,BP Investment Management Ltd., ,
05LQW5-E,Clough Capital Partners LP, ,
066BNY-E,Credit Andorra,Incorrect: style-(Ownership:None Profile: ) ,
05SYRM-E,Los Angeles City Employees Retirement System,,
0B4476-E,Ossiam SA, ,
0049LM-E,Two Sigma Investments LP, ,
0B6K88-E,Cambria Investment Management LP, ,
05G6NV-E,Nordea Investment Management AB, ,
002PL7-E,Moody National Bank (Trust Division), ,
002GG9-E,McKinley Capital Management LLC, ,
05LVK2-E,Fruth Investment Management, ,
05MFWB-E,Huntington National Bank (Investment Management), ,
002JPV-E,Allstate Investment Management Co., ,
0DMS5B-E,Capital Bank & Trust Co. (Investment Management), ,
002GF6-E,"Argus Investors' Counsel, Inc.", ,
002H57-E,"Armstrong Shaw Associates, Inc.", ,
0CW4TM-E,Silvercrest Asset Management Group LLC, ,
05GPWC-E,The Oregon Investment Council, ,
001YX3-E,"Securian Asset Management, Inc.", ,
05GBGD-E,Amundi Deutschland GmbH, ,
002HDX-E,Arcadia Investment Management Corp., ,
0CV2GP-E,Ascent Wealth Partners LLC, ,
0C8883-E,Blue Rock Advisors LLC, ,
00DJHK-E,Summit Global Investments LLC, ,
0C27BS-E,Signet Financial Management LLC, ,
003SP6-E,Capital Analysts LLC, ,
05KSHP-E,Callan LLC, ,
002HXZ-E,Teachers Retirement System of the State of Kentucky, ,
06C27W-E,"NLB Skladi, d.o.o.", ,
00FH8G-E,Segment Wealth Management LLC, ,
003BXT-E,Nichols & Pratt Advisers LLP, ,
00189R-E,"UMB Bank, NA (Investment Management)", ,
0C7GG6-E,Stratos Wealth Partners Ltd., ,
09KLWX-E,Brookfield Public Securities Group LLC, ,
002HRC-E,"Crossmark Global Investments, Inc.", ,
0C27D7-E,Scholtz & Co. LLC, ,
00GFHN-E,Aberdeen Standard Capital Ltd., ,
002H07-E,Charter Trust Co., ,
0HQYQK-E,BancorpSouth Bank (Investment Management), ,
0076G4-E,Covington Capital Management, ,
0693ZZ-E,Colonial First State Asset Management (Australia) Ltd., ,
0FJYPK-E,Institutional & Family Asset Management LLC, ,
002J58-E,"MUFG Union Bank, NA", ,
001207-E,Segall Bryant & Hamill LLC, ,
003L7B-E,"Cornerstone Advisors, Inc.", ,
071FY0-E,"FIS Group, Inc.", ,
07NQS6-E,Weiler & Eberhardt Depotverwaltung AG, ,
05HDD9-E,Manulife Asset Management (Hong Kong) Ltd., ,
0C3PPV-E,EagleClaw Capital Management LLC,Incorrect: aum-(Ownership:238 Profile: 263) eaum-(Ownership:224.858864 Profile: 231) ,
003RLJ-E,"Carderock Capital Management, Inc.", ,
001MDY-E,Ontario Teachers' Pension Plan Board, ,
008K0W-E,United Capital Financial Advisers LLC, ,
009K4M-E,Security Investors LLC, ,
05JJC3-E,Tredje AP-fonden, ,
0F1YWP-E,River Wealth Advisors LLC, ,
000KVL-E,"GAMCO Asset Management, Inc.", ,
002DFS-E,Maverick Capital Ltd., ,
00CX44-E,DBX Advisors LLC, ,
0814VH-E,Delta Capital Management LLC (New York), ,
0CVCK1-E,"Pacer Advisors, Inc.", ,
006840-E,"Morgan Stanley Investment Management, Inc.", ,
0DY7G5-E,Ropes Wealth Advisors LLC, ,
0CQGBF-E,Great Lakes Advisors LLC, ,
002J55-E,"TWIN Capital Management, Inc.", ,
0612GZ-E,The Public Sector Pension Investment Board, ,
002GL7-E,New Mexico Educational Retirement Board, ,
0GLJY4-E,Northstar Capital Management LLC, ,
004VF9-E,Security National Trust Co., ,
0HJZ2P-E,Albar Capital Ltd., ,
05TBQH-E,Wolverine Asset Management LLC, ,
061VCS-E,First American Bank (Asset Management), ,
0J04L5-E,Keeler Thomas Management LLC, ,
0022CW-E,"Foresters Investment Management Co., Inc.", ,
002HYG-E,"David Wendell Associates, Inc.", ,
0JVWCD-E,"People's United Advisors, Inc.", ,
05J6JN-E,"The Dai-ichi Life Insurance Co., Ltd. (Investment Portfolio)", ,
0G1KQH-E,Degroof Petercam Asset Management SA, ,
05K7XR-E,CAPFI DELEN Asset Management SA, ,
002GB3-E,Prio Wealth LP, ,
05G23H-E,Water Island Capital LLC, ,
009S8T-E,"Ameritas Investment Partners, Inc.", ,
009JC8-E,"GHP Investment Advisors, Inc.", ,
0CN45L-E,1919 Investment Counsel & Trust Co. NA,,
0DV7CF-E,Long Road Investment Counsel LLC, ,
07PWJV-E,Northwest & Ethical Investments LP, ,
0GN6R7-E,Corient Capital Partners LLC, ,
002J0Q-E,"Fort Washington Investment Advisors, Inc.", ,
0C2W81-E,Vision2020 Wealth Management Corp., ,
0C87M4-E,"Benson Investment Management Co., Inc.", ,
05P5CR-E,Federated Investment Management Co., ,
0CS1H1-E,JPMorgan (Suisse) SA, ,
0GCW2M-E,"SunTrust Advisory Services, Inc.", ,
0043R8-E,Marshall Wace LLP, ,
0DFPJV-E,Sumitomo Mitsui Banking Corp. (Investment Management), ,
07BYPL-E,Pendal Group Ltd. (Investment Management), ,
0718CY-E,The Municipal Employees' Retirement System of Michigan, ,
003K71-E,Harvey Investment Co. LLC, ,
0DYG40-E,Amica Mutual Insurance Co. (Investment Portfolio), ,
05N4PC-E,Jefferies Investment Advisers LLC, ,
05K1YC-E,Eurizon Capital SA, ,
002PKH-E,Goldman Sachs International, ,
05J6V0-E,The Bryn Mawr Trust Co., ,
006YGC-E,Farmers Trust Co., ,
006VRV-E,SG Americas Securities LLC, ,
05GXG4-E,OP Asset Management Ltd., ,
003C5M-E,TCW Investment Management Co LLC, ,
05G86V-E,Kempen Capital Management NV, ,
0070ZJ-E,Cutler Group LP, ,
0C8Z9C-E,"Covington Investment Advisors, Inc.", ,
0H6JNC-E,Credit Suisse Asset Management (Schweiz) AG, ,
0C3D9M-E,Atria Investments LLC, ,
0FFZ67-E,Jyske Bank A/S (Investment Management), ,
0GPW6Y-E,W.E. Donoghue & Co. LLC, ,
0090BC-E,Azimuth Capital Management LLC, ,
0G1NZK-E,Perennial Advisors LLC (New York), ,
00FC62-E,Riverhead Capital Management LLC, ,
0631M3-E,IFM Investors Pty Ltd., ,
002J2V-E,"Moody, Lynn & Lieberson LLC", ,
00103D-E,"Northeast Investment Management, Inc.", ,
074MNH-E,"World Asset Management, Inc.", ,
05QR9Z-E,Horizon Investments LLC, ,
004GM6-E,"1st Source Corporation Investment Advisors, Inc.", ,
06LJ1K-E,Aegon PTE SA, ,
0CJK8G-E,Monyx Financial Group AB, ,
05J8FZ-E,"Univest Investments, Inc.", ,
0CZNZJ-E,Private Advisor Group LLC, ,
05LQ04-E,Kentucky Retirement Systems, ,
